Flucht­wa­gen-Fah­rer und Freund bei stür­mi­schem Wet­ter,Getaway driver and friend in stormy weather,,,,,,German,English
die Widmung,the dedication (to),,,,,,German,English
und ein Stück Spiegelei baumelte von seinem buschigen Schnauzbart herunter,and a piece of fried egg dangled from his bushy moustache,,,,Spiegelei = fried egg<br>herunter = down,,German,English
und doch hat er es getan,and yet he did it,,,,"doch = but still/all the same<br>hat from haben<br>getan = ""done"" = past participle of ""tun"" = ""to do""",,German,English
"doch seine Worte gingen in einem lang gezogenen, lauten Rülpser unter","but his words were drowned in a long, loud belch",,,gehen = to go (gingen)<br>,lang = long<br>lang gezogen = stretched out<br>laut = loud<br>Rülpser = belch,,German,English
Sonst fliegt sie doch immer draußen rum.,Otherwise she's (Hedwig) always flying around outside.,,,,immer = always<br>draußen = outside<br>rum = around,,German,English
Urheber dessen war Dudley.,The originator/creator of this was Dudley.,,,,,,German,English
